{
  "source_item_id": 302,
  "language_code": "en",
  "slug": "aaro-new-uap-case-resolution-portal",
  "display_title": "Pentagon AARO Releases New UAP Case Resolution Portal",
  "summary_short": "The Pentagon's All-domain Anomaly Resolution Office published a new public portal documenting resolved UAP cases, including video stills and methodological notes for each disposition.",
  "bullets": null,
  "canonical_url": "https://example.com/aaro-case-resolution-portal",
  "source_published_at": "2026-07-18T17:45:00Z",
  "approved_at": "2026-07-19T08:20:00Z",
  "published_at": "2026-07-22T03:00:00Z",
  "downstream_action": "publish_link",
  "disclosure_note": "This item is AI-generated.",
  "author_metadata": {
    "source_module": "curate",
    "writer_type": "machine"
  }
}
